{
  "$schema": "https://json-schema.org/draft/2020-12/schema",
  "$id": "https://overkill-factory.dev/schemas/customer-readiness-gate.schema.json",
  "title": "Overkill Factory Customer Readiness Gate",
  "type": "object",
  "required": [
    "$schema",
    "record_type",
    "decision",
    "target_user_or_customer",
    "first_success_path",
    "onboarding_handoff",
    "support_path",
    "terms_compliance_boundary",
    "data_privacy_boundary",
    "limits_of_use",
    "acceptance_owner",
    "evidence_refs"
  ],
  "properties": {
    "$schema": {
      "const": "https://overkill-factory.dev/schemas/customer-readiness-gate.schema.json"
    },
    "record_type": { "const": "customer_readiness_gate" },
    "decision": { "enum": ["PASS", "WAIVED", "BLOCKED"] },
    "target_user_or_customer": { "type": "string", "minLength": 3 },
    "first_success_path": { "type": "string", "minLength": 3 },
    "onboarding_handoff": { "type": "string", "minLength": 3 },
    "support_path": { "type": "string", "minLength": 3 },
    "terms_compliance_boundary": { "type": "string", "minLength": 3 },
    "data_privacy_boundary": { "type": "string", "minLength": 3 },
    "limits_of_use": {
      "type": "array",
      "minItems": 1,
      "items": { "type": "string", "minLength": 3 }
    },
    "acceptance_owner": { "type": "string", "minLength": 3 },
    "evidence_refs": {
      "type": "array",
      "minItems": 1,
      "items": { "type": "string", "minLength": 3 }
    },
    "next_required_action": { "type": "string", "minLength": 3 },
    "waiver": {
      "type": "object",
      "required": [
        "owner",
        "reason",
        "expires_at",
        "cannot_claim_customer_ready",
        "next_required_action",
        "evidence_refs"
      ],
      "properties": {
        "owner": { "type": "string", "minLength": 3 },
        "reason": { "type": "string", "minLength": 3 },
        "expires_at": { "type": "string", "minLength": 10 },
        "cannot_claim_customer_ready": { "const": true },
        "next_required_action": { "type": "string", "minLength": 3 },
        "evidence_refs": {
          "type": "array",
          "minItems": 1,
          "items": { "type": "string", "minLength": 3 }
        }
      },
      "additionalProperties": true
    }
  },
  "allOf": [
    {
      "if": {
        "properties": { "decision": { "const": "WAIVED" } },
        "required": ["decision"]
      },
      "then": { "required": ["waiver"] }
    },
    {
      "if": {
        "properties": { "decision": { "const": "BLOCKED" } },
        "required": ["decision"]
      },
      "then": { "required": ["next_required_action"] }
    }
  ],
  "additionalProperties": true
}
